{
  "schemaVersion": 1,
  "rulesVersion": "1.0.0",
  "contentRevision": 1,
  "engineCompatRange": ">=1.0.0 <2.0.0",
  "nearTieMarginBasisPoints": 300,
  "constraints": [
    {
      "dimension": "DataSensitivity",
      "title": "Data Sensitivity",
      "polarity": "Demand",
      "help": "How much regulatory or confidentiality control the content demands.",
      "maxLevel": 4,
      "defaultWeightTier": 2,
      "levels": [
        {
          "value": 0,
          "name": "Public",
          "help": "Safe to share outside the organization.",
          "evidence": "A published help article."
        },
        {
          "value": 1,
          "name": "Internal",
          "help": "Low harm if disclosed inside the org.",
          "evidence": "Team notes or an internal wiki."
        },
        {
          "value": 2,
          "name": "Confidential",
          "help": "Access-controlled business information.",
          "evidence": "Unreleased plans or internal policies."
        },
        {
          "value": 3,
          "name": "Regulated",
          "help": "Subject to legal handling obligations.",
          "evidence": "Personal data covered by privacy law."
        },
        {
          "value": 4,
          "name": "Restricted",
          "help": "A strict handling regime with audit duties.",
          "evidence": "Health, payment, or similarly governed categories (illustrative)."
        }
      ],
      "demandCurve": [
        0,
        1,
        2,
        3,
        4
      ]
    },
    {
      "dimension": "LatencyTarget",
      "title": "Latency Target",
      "polarity": "Demand",
      "help": "How quickly a result is needed.",
      "maxLevel": 3,
      "defaultWeightTier": 1,
      "levels": [
        {
          "value": 0,
          "name": "Relaxed",
          "help": "Offline or background processing is fine.",
          "evidence": "An overnight batch job."
        },
        {
          "value": 1,
          "name": "Standard",
          "help": "A short wait is acceptable.",
          "evidence": "A few-second asynchronous reply."
        },
        {
          "value": 2,
          "name": "Interactive",
          "help": "Someone is waiting on the answer.",
          "evidence": "A chat response in a UI."
        },
        {
          "value": 3,
          "name": "Immediate",
          "help": "Consistently tight, low latency is required.",
          "evidence": "Inline assistance while typing."
        }
      ],
      "demandCurve": [
        0,
        2,
        3,
        4
      ]
    },
    {
      "dimension": "CostPressure",
      "title": "Cost Pressure",
      "polarity": "Demand",
      "help": "How strongly per-item cost constrains the design.",
      "maxLevel": 3,
      "defaultWeightTier": 1,
      "levels": [
        {
          "value": 0,
          "name": "Low",
          "help": "Cost is not a limiting factor.",
          "evidence": "Occasional, low-volume use."
        },
        {
          "value": 1,
          "name": "Moderate",
          "help": "Cost matters but there is headroom.",
          "evidence": "Steady but bounded volume."
        },
        {
          "value": 2,
          "name": "High",
          "help": "Cost strongly shapes design choices.",
          "evidence": "Large volume under a budget."
        },
        {
          "value": 3,
          "name": "Severe",
          "help": "A hard per-item budget ceiling applies.",
          "evidence": "Millions of items at fractions of a cent each."
        }
      ],
      "demandCurve": [
        0,
        2,
        3,
        4
      ]
    },
    {
      "dimension": "DeterminismReproducibility",
      "title": "Determinism & Reproducibility",
      "polarity": "Demand",
      "help": "How repeatable and defensible outputs must be.",
      "maxLevel": 3,
      "defaultWeightTier": 1,
      "levels": [
        {
          "value": 0,
          "name": "Flexible",
          "help": "Run-to-run variation is acceptable.",
          "evidence": "Exploratory drafting."
        },
        {
          "value": 1,
          "name": "Preferred",
          "help": "Consistency is valued but not required.",
          "evidence": "Internal summaries."
        },
        {
          "value": 2,
          "name": "Required",
          "help": "Same input yields materially the same output, and this is checked.",
          "evidence": "A validated extraction step."
        },
        {
          "value": 3,
          "name": "Auditable",
          "help": "Outputs must be reproducible and defensible on review.",
          "evidence": "Regulated reporting."
        }
      ],
      "demandCurve": [
        0,
        2,
        3,
        4
      ]
    },
    {
      "dimension": "KnowledgeFreshness",
      "title": "Knowledge Freshness",
      "polarity": "Demand",
      "help": "How current the underlying facts must be.",
      "maxLevel": 3,
      "defaultWeightTier": 2,
      "levels": [
        {
          "value": 0,
          "name": "Stable",
          "help": "Relies only on long-lived knowledge.",
          "evidence": "Definitions that rarely change."
        },
        {
          "value": 1,
          "name": "Periodic",
          "help": "Facts change on a slow cadence.",
          "evidence": "Figures revised each quarter."
        },
        {
          "value": 2,
          "name": "Frequent",
          "help": "Facts change weekly or daily.",
          "evidence": "Policies updated as rules evolve."
        },
        {
          "value": 3,
          "name": "Current",
          "help": "Answers must reflect the latest available information.",
          "evidence": "The most recently published version of a document."
        }
      ],
      "demandCurve": [
        0,
        2,
        3,
        4
      ]
    },
    {
      "dimension": "ToolActionNeed",
      "title": "Tool & Action Need",
      "polarity": "Demand",
      "help": "Whether the task must reach outside the prompt to act.",
      "maxLevel": 3,
      "defaultWeightTier": 1,
      "levels": [
        {
          "value": 0,
          "name": "None",
          "help": "Nothing beyond the prompt is needed.",
          "evidence": "Rewriting a supplied passage."
        },
        {
          "value": 1,
          "name": "Lookup",
          "help": "Read-only reference fetches are needed.",
          "evidence": "Retrieving a passage."
        },
        {
          "value": 2,
          "name": "Guarded",
          "help": "Bounded, side-effecting actions behind guards.",
          "evidence": "Creating a draft ticket."
        },
        {
          "value": 3,
          "name": "Autonomous",
          "help": "Open-ended, multi-step tool use.",
          "evidence": "Search, synthesize, and iterate across sources."
        }
      ],
      "demandCurve": [
        0,
        2,
        3,
        4
      ]
    },
    {
      "dimension": "HumanReview",
      "title": "Human Review",
      "polarity": "Demand",
      "help": "How much human oversight the process requires.",
      "maxLevel": 4,
      "defaultWeightTier": 1,
      "levels": [
        {
          "value": 0,
          "name": "Unattended",
          "help": "Output is used without review.",
          "evidence": "Low-stakes suggestions."
        },
        {
          "value": 1,
          "name": "SpotCheck",
          "help": "Occasional ad-hoc checks.",
          "evidence": "Periodic quality sampling."
        },
        {
          "value": 2,
          "name": "Sampled",
          "help": "A defined sample is reviewed.",
          "evidence": "Auditing a fixed percentage."
        },
        {
          "value": 3,
          "name": "PreUse",
          "help": "Every output is reviewed before use.",
          "evidence": "Analyst-in-the-loop drafting."
        },
        {
          "value": 4,
          "name": "PerAction",
          "help": "A human approves each consequential action.",
          "evidence": "Sign-off before any external effect."
        }
      ],
      "demandCurve": [
        0,
        1,
        2,
        3,
        4
      ]
    },
    {
      "dimension": "OperationalMaturity",
      "title": "Operational Maturity",
      "polarity": "Capacity",
      "help": "How much monitoring, evaluation, and on-call support the deployment context can provide (higher = more capacity).",
      "maxLevel": 3,
      "defaultWeightTier": 1,
      "levels": [
        {
          "value": 0,
          "name": "Nascent",
          "help": "Little monitoring or evaluation capacity.",
          "evidence": "A first prototype."
        },
        {
          "value": 1,
          "name": "Developing",
          "help": "Basic logging and manual checks.",
          "evidence": "An early internal tool."
        },
        {
          "value": 2,
          "name": "Established",
          "help": "Monitoring, evaluation sets, and an incident process exist.",
          "evidence": "A supported production service."
        },
        {
          "value": 3,
          "name": "Advanced",
          "help": "Automated evaluation, guardrails, on-call, and rollback.",
          "evidence": "A mature platform team."
        }
      ],
      "demandCurve": [
        4,
        3,
        1,
        0
      ]
    }
  ],
  "patterns": [
    {
      "id": "DirectStructuredCall",
      "name": "Direct structured model call",
      "summary": "A single model call that returns output shaped to a fixed schema, with no retrieval or external tools. It is the simplest and fastest option and the easiest to operate, but it depends entirely on the model's built-in knowledge and offers limited grounding or reproducibility.",
      "capabilities": [
        4,
        4,
        4,
        3,
        0,
        0,
        3,
        4
      ],
      "rationales": [